<?xml version="1.0" encoding="UTF-8"?>
<appvet:Tool xmlns:appvet="http://appvet.github.io/appvet/schemas"
	xmlns:xsi="http://www.w3.org/2001/XMLSchema-instance"
	xsi:schemaLocation="http://appvet.github.io/appvet/schemas ToolProperties.xsd ">
	<appvet:Name>Android Androwarn Service</appvet:Name>
	<appvet:Version>1.0</appvet:Version>
	<appvet:ServiceURL>http://127.0.0.1:8080/android-androwarn-toolservice</appvet:ServiceURL>
	<appvet:AppVetProtocol>ASYNCHRONOUS</appvet:AppVetProtocol>
	<appvet:AppOs>ANDROID</appvet:AppOs>
	<appvet:KeepApps>true</appvet:KeepApps>
	<appvet:Command>python [ANDROWARN_HOME]/androwarn.py -i [APP_FILE_PATH] -v 1 -d -L ERROR -n</appvet:Command>
	<!-- 1200000ms = 20 minute command timeout -->
	<appvet:CommandTimeout>1200000</appvet:CommandTimeout>
	<appvet:Logging>
		<appvet:Level>DEBUG</appvet:Level>
		<appvet:ToConsole>true</appvet:ToConsole>
		<appvet:LogName>log.txt</appvet:LogName>
	</appvet:Logging>
	<appvet:Report>
		<appvet:Format>HTML</appvet:Format>
		<appvet:Result>
			<appvet:DefaultStatus>LOW</appvet:DefaultStatus>
			<appvet:Error>Traceback</appvet:Error>
			<appvet:Moderate>Telephony Identifiers Leakage</appvet:Moderate>
			<appvet:Moderate>Device Settings Harvesting</appvet:Moderate>
			<appvet:Moderate>Location Lookup</appvet:Moderate>
			<appvet:Moderate>Connection Interfaces Exfiltration</appvet:Moderate>
			<appvet:Moderate>Telephony Services Abuse</appvet:Moderate>
			<appvet:Moderate>Audio Video Eavesdropping</appvet:Moderate>
			<appvet:Moderate>Suspicious Connection Establishment</appvet:Moderate>
			<appvet:Moderate>Pim Data Leakage</appvet:Moderate>
			<appvet:Moderate>Code Execution</appvet:Moderate>
		</appvet:Result>
	</appvet:Report>
	<appvet:AppVet>
		<appvet:URL>http://127.0.0.1:8080/appvet/AppVetServlet</appvet:URL>
		<appvet:Method>POST</appvet:Method>
		<appvet:ToolId>androwarn</appvet:ToolId>
		<appvet:Username>androwarn-username</appvet:Username>
		<appvet:Password>androwarn-password</appvet:Password>
	</appvet:AppVet>
</appvet:Tool>